{
  "contract_version": "1.1.0",
  "status": "BLOCKED",
  "reason_code": "UNEXPECTED_DATA_FIELD_COUNT",
  "local_file_deleted": true,
  "logical_deletion_only": true,
  "physical_secure_erasure_guaranteed": false,
  "archive_byte_count": 409477526,
  "schema_result": {
    "contract_version": "1.0.0",
    "status": "BLOCKED",
    "reason_code": "UNEXPECTED_DATA_FIELD_COUNT",
    "source_id": "ny.osc.unclaimed_funds.owner_name_file",
    "gate_id": "HUMAN_NY_OSC_OWNER_NAME_FILE_FIRST_DOWNLOAD_TRANSIENT_PII_AUTHORIZATION",
    "approval_id": "OWNER_APPROVAL_2026-09-20_NY_OSC_FIFTH_BOUNDED_TRANSIENT_PII_ATTEMPT_ONCE_35474594",
    "archive_byte_count": 409477526,
    "archive_member_count": 1,
    "member_names_persisted": false,
    "selected_text_member_present": true,
    "selected_member_uncompressed_bytes": 1939569781,
    "observed_delimiter": "|",
    "documented_layout_field_count": 14,
    "observed_data_field_count": 13,
    "observed_header_state": "NO_HEADER_OBSERVED",
    "physical_header_names": [],
    "aggregate_complete_record_count": 213454,
    "property_type_code_column_index_zero_based": 1,
    "property_type_ascii_record_count": 213454,
    "nature_of_property_mapping_state": "NOT_CONFIRMED",
    "encoding_state": "NOT_EVALUATED_BYTE_LEVEL_DISCOVERY_ONLY",
    "raw_file_persisted": false,
    "owner_rows_persisted": false,
    "owner_field_logging": false,
    "row_specific_human_inspection": false,
    "no_owner_values_returned": true
  },
  "structural_diagnostic": {
    "contract_version": "1.0.0",
    "source_id": "ny.osc.unclaimed_funds.owner_name_file",
    "diagnostic_scope": "STRUCTURAL_ONLY",
    "reason_code": "UNEXPECTED_DATA_FIELD_COUNT",
    "classification": "QUOTED_DELIMITER_INTERACTION_AMBIGUOUS",
    "expected_field_count": 14,
    "structural_field_count": 13,
    "raw_pipe_count": 228072,
    "structural_pipe_count": 12,
    "suppressed_pipe_count": 228060,
    "quote_byte_count": 3,
    "quote_open_event_count": 1,
    "quote_close_event_count": 1,
    "doubled_quote_pair_count": 0,
    "physical_line_breaks_inside_quotes": 17543,
    "ended_inside_quote": false,
    "no_raw_record_returned": true,
    "no_owner_values_returned": true
  },
  "no_raw_path_returned": true,
  "no_owner_values_returned": true
}
